{
  "$schema": "https://json-schema.org/draft/2020-12/schema",
  "$id": "https://example.local/runtime/knowledge_state.schema.json",
  "title": "Player or Team Knowledge State",
  "description": "A private/team evidence model. It records beliefs and authored Evidence without duplicating authoritative machine or Fault state.",
  "type": "object",
  "additionalProperties": false,
  "$defs": {
    "entityRef": {
      "type": "string",
      "pattern": "^[a-z0-9]+(?:[._-][a-z0-9]+)*$"
    },
    "instanceId": { "type": "string", "minLength": 1 },
    "timestamp": { "type": "string", "format": "date-time" }
  },
  "properties": {
    "knowledge_state_id": { "$ref": "#/$defs/instanceId" },
    "ticket_instance_id": { "$ref": "#/$defs/instanceId" },
    "audience": { "type": "string", "enum": ["PRIVATE_PLAYER", "TEAM"] },
    "owner_player_id": { "type": ["string", "null"], "minLength": 1 },
    "team_id": { "type": ["string", "null"], "minLength": 1 },
    "known_symptom_ids": {
      "type": "array",
      "items": { "$ref": "#/$defs/entityRef" },
      "uniqueItems": true
    },
    "candidate_assessments": {
      "type": "array",
      "items": {
        "type": "object",
        "additionalProperties": false,
        "properties": {
          "candidate_fault_id": { "$ref": "#/$defs/entityRef" },
          "assessment": {
            "type": "string",
            "enum": ["UNASSESSED", "SUSPECTED", "SUPPORTED", "CONTRADICTED", "RULED_OUT", "CONFIRMED"]
          },
          "supporting_evidence_event_ids": {
            "type": "array",
            "items": { "$ref": "#/$defs/instanceId" },
            "uniqueItems": true
          }
        },
        "required": ["candidate_fault_id", "assessment", "supporting_evidence_event_ids"]
      }
    },
    "current_hypothesis": {
      "type": "object",
      "additionalProperties": false,
      "properties": {
        "candidate_fault_ids": {
          "type": "array",
          "items": { "$ref": "#/$defs/entityRef" },
          "uniqueItems": true,
          "maxItems": 2
        },
        "revised_at_revision": { "type": "integer", "minimum": 0 }
      },
      "required": ["candidate_fault_ids", "revised_at_revision"]
    },
    "evidence": {
      "type": "array",
      "items": {
        "type": "object",
        "additionalProperties": false,
        "properties": {
          "evidence_event_id": { "$ref": "#/$defs/instanceId" },
          "action_event_id": { "$ref": "#/$defs/instanceId" },
          "source_type": {
            "type": "string",
            "enum": ["TEST", "COMMAND", "INSPECTION", "VERIFY", "SYSTEM"]
          },
          "source_definition_id": { "$ref": "#/$defs/entityRef" },
          "authored_outcome_id": { "$ref": "#/$defs/entityRef" },
          "candidate_fault_id": {
            "type": ["string", "null"],
            "pattern": "^[a-z0-9]+(?:[._-][a-z0-9]+)*$"
          },
          "disposition": {
            "type": "string",
            "enum": ["SUPPORT", "CONTRADICT", "RULE_OUT", "CONFIRM", "INCONCLUSIVE"]
          },
          "observation_id": {
            "type": ["string", "null"],
            "pattern": "^[a-z0-9]+(?:[._-][a-z0-9]+)*$"
          },
          "visibility": { "type": "string", "enum": ["PRIVATE_PLAYER", "TEAM"] },
          "machine_revision": { "type": "integer", "minimum": 0 },
          "diagnosis_revision": { "type": "integer", "minimum": 0 },
          "captured_at": { "$ref": "#/$defs/timestamp" },
          "documented_by_publication_event_id": {
            "type": ["string", "null"],
            "minLength": 1
          }
        },
        "required": [
          "evidence_event_id",
          "action_event_id",
          "source_type",
          "source_definition_id",
          "authored_outcome_id",
          "candidate_fault_id",
          "disposition",
          "observation_id",
          "visibility",
          "machine_revision",
          "captured_at",
          "documented_by_publication_event_id"
        ]
      }
    },
    "elimination_records": {
      "type": "array",
      "items": {
        "type": "object",
        "additionalProperties": false,
        "properties": {
          "elimination_event_id": { "$ref": "#/$defs/instanceId" },
          "candidate_fault_id": { "$ref": "#/$defs/entityRef" },
          "eliminated": { "type": "boolean" },
          "cited_evidence_event_ids": { "type": "array", "items": { "$ref": "#/$defs/instanceId" }, "uniqueItems": true },
          "diagnosis_revision": { "type": "integer", "minimum": 0 },
          "supersedes_elimination_event_id": { "type": ["string", "null"], "minLength": 1 }
        },
        "required": ["elimination_event_id", "candidate_fault_id", "eliminated", "cited_evidence_event_ids", "diagnosis_revision", "supersedes_elimination_event_id"]
      }
    },
    "last_updated_revision": { "type": "integer", "minimum": 0 }
  },
  "required": [
    "knowledge_state_id",
    "ticket_instance_id",
    "audience",
    "owner_player_id",
    "team_id",
    "known_symptom_ids",
    "candidate_assessments",
    "current_hypothesis",
    "evidence",
    "last_updated_revision"
  ],
  "allOf": [
    {
      "if": { "properties": { "audience": { "const": "PRIVATE_PLAYER" } } },
      "then": {
        "properties": {
          "owner_player_id": { "type": "string", "minLength": 1 },
          "team_id": { "const": null },
          "evidence": {
            "items": { "properties": { "visibility": { "const": "PRIVATE_PLAYER" } } }
          }
        }
      }
    },
    {
      "if": { "properties": { "audience": { "const": "TEAM" } } },
      "then": {
        "properties": {
          "owner_player_id": { "const": null },
          "team_id": { "type": "string", "minLength": 1 },
          "evidence": {
            "items": { "properties": { "visibility": { "const": "TEAM" } } }
          }
        }
      }
    }
  ]
}
